{
  "schema_version": 1,
  "id": "flutter/login/login_form__locale=ja,theme=dark",
  "platform": "flutter",
  "capture": "widget",
  "group": "login",
  "name": "login_form",
  "display_name": "login_form__locale=ja,theme=dark.png",
  "variant": {
    "locale": "ja",
    "theme": "dark"
  },
  "image": {
    "width": 800,
    "height": 600,
    "scale": 1.0
  },
  "env": {
    "os": "macos",
    "arch": "aarch64",
    "sdk": "3.41.6",
    "ci": false
  },
  "ext": {
    "flutter": {
      "golden_uri": "login_form__locale=ja,theme=dark.png",
      "test_dir": "login"
    }
  }
}
