{
  "schema_version": 1,
  "id": "flutter/login/login_form__locale=en,theme=dark",
  "platform": "flutter",
  "capture": "widget",
  "group": "login",
  "name": "login_form",
  "display_name": "login_form__locale=en,theme=dark.png",
  "variant": {
    "locale": "en",
    "theme": "dark"
  },
  "image": {
    "width": 800,
    "height": 600,
    "scale": 1.0
  },
  "env": {
    "os": "macos",
    "arch": "aarch64",
    "sdk": "3.41.6",
    "ci": false
  },
  "captured_at": "2026-09-21T12:00:01.114221Z",
  "ext": {
    "flutter": {
      "golden_uri": "login_form__locale=en,theme=dark.png",
      "test_dir": "login",
      "run_id": "1789991999684-80307"
    }
  }
}